Number	Votes	Question
Q1	6	Android Floating Action Button API 19 (KitKat)
Q2	6	How to zoom Android TableLayout
Q3	5	Understanding memory leaks in Android application
Q4	5	NoClassDefFoundError when running PopupMenu using android-support-v7-appcompat library in android
Q5	5	why adding &lt;merge&gt; changes the android layout?
Q6	5	Custom rangeseekbar android with one thumb
Q7	5	How to have a Fullscreen Background Image (with center-crop) that doesn&#39;t Resize
Q8	5	LinearLayout in navigation drawer
Q9	5	No resource identifier found for attribute &#39;paddingEnd&#39; in Package &#39;android&#39;
Q10	4	Android How to edit the Action bar menu from Fragment