Number	Votes	Question
Q1	34	Why Hash Code of different Boolean instances is always the same?
Q2	16	Is Java 8 missing an OptionalBoolean?
Q3	5	Is setting a boolean to false redundant?
Q4	4	Why doesn&#39;t Java have a BooleanStream?
Q5	4	The precedence of java boolean
Q6	4	How to compare Boolean properly?
Q7	3	Why does indexof fail for arrays converted to lists in java?
Q8	3	Boolean Logical not operator on Integer Java
Q9	3	convert from boolean to byte in java
Q10	3	Can I manipulate Boolean values as ints in Java?