Number	Votes	Question
Q1	6	How to determine if a GPS coordinate lies within a rectangular area?
Q2	5	How do I figure out longitude and latitude coordinates to create a 1 mile radius around a user&#39;s location?
Q3	4	LibGDX: Skin + Custom Coordinates Draw Incorrectly
Q4	3	Wrong coordinates for different objects
Q5	3	Calculating distance in pixels between two locations
Q6	3	How can I get the coordinates of a cell in a JTable?
Q7	2	Elliptic Curve Point Addition in Jacobian Coordinates
Q8	2	How do I get the coordinates of a diagonal circle?
Q9	2	PVector Heading() for 3D Rotation