Number	Votes	Question
Q1	5	Inserting $ into formatted float java
Q2	3	How to show formatted contact numbers?
Q3	3	Why exceptions are thrown by format() function instead of compile time error?
Q4	2	Converting time to &quot;HH:mm:ss&quot; using Calendar and SimpleDateFormat adds 1 hour
Q5	2	Formatting an output
Q6	2	How can I hyperlink one comment from another comment location in javadoc
Q7	2	Is there a common naming convention for variables containing string formats?
Q8	2	Prevent JAXB from converting String to Number (JSON)
Q9	2	Java- Get decimal at position n