Number	Votes	Question
Q1	7	Java GridBagLayout not working
Q2	6	java unreasonable jtextfield sizing issue
Q3	5	GridBagLayout gridding not working
Q4	4	GridBagLayout doesn&#39;t accept my rowspan command(gridtheight)
Q5	3	Why does this GridBagLayout not appear as planned?
Q6	3	JProgressBar Gets Squeezed/ Resizes Improperly
Q7	3	Can components of a gridbaglayout fill parent frame upon resize?
Q8	3	JToolBar IllegalArgumentException when dropped back into GridBagLayout
Q9	2	GridBagLayout Uniformity Issue
Q10	2	Multiple JPanel with different width inside a JFrame using GridBagLayout