Number	Votes	Question
Q1	17	smooth rounded corners in swing
Q2	11	How to make Java JButton visually depress with touch screen?
Q3	5	How to make Round JButtons in Java
Q4	5	Is there a more efficient way to handle button click events than several if statements?
Q5	4	How to properly use the MouseMotionListener to press JButtons?
Q6	4	How can my ActionListener for a JButton access variables in another class?
Q7	3	JButton needs to display array of images
Q8	3	JButton default cursor
Q9	3	How to simulate movement of specific JButtons in an array of JButtons
Q10	3	Need a little help  in hiding/disabling the jbutton