Number	Votes	Question
Q1	15	String class make confusion
Q2	11	this keyword in java
Q3	5	Why doesn&#39;t java have .field and .method reflection keywords like .class?
Q4	4	Add or modify keywords in java language
Q5	3	JNA and Java Language Keywords
Q6	3	Keyword length returning a value in java for an array
Q7	2	what is the difference between method(String str) and method(Final String str)
Q8	2	Robot Framework with Selenium and Java Keywords
Q9	2	Why are there keywords in Java that have no usage  yet are reserved?
Q10	2	Why am I getting &lt;identifier&gt; expected error?