Number	Votes	Question
Q1	6	how to find key listener on any where in window
Q2	3	Java enum that registers as listener on creation
Q3	3	Android callback listener - send value from pojo in SDK to an application&#39;s activity
Q4	3	How to reimplement Java listeners with anonymous classes in C#
Q5	3	Does Component#removeAll() clean up Observer/Listeners of removed controlls?
Q6	3	How to combine and validate two text fields for a swt dialog?
Q7	2	What if the computation inside a listener is slow than the listener&#39;s update?
Q8	2	Understanding Java Callbacks/Events in Matlab
Q9	2	Listener on Method.invoke java
Q10	2	Java Swing - Why is this no longer draggable?