Number	Votes	Question
Q1	23	Java Math.min/max performance
Q2	5	How can I create or set JodaTime DateTime objects with/to maximum value?
Q3	3	How to find maximum element on left hand side of an element which is smaller than the element?
Q4	2	List of objects which have a max value
Q5	2	How to create max method that gets 4 numbers and returns the maximum number?
Q6	2	Incrementing MAX_VALUE of primitve type
Q7	2	Get max key of Map&lt;K V&gt; using lambda
Q8	2	in Java  design linear algorithm that finds contiguous subsequence with highest sum