Number	Votes	Question
Q1	6	Memory leak in netty API
Q2	6	Netty EventExecutorGroup breaks pipeline
Q3	3	How do I handle http requests larger than 1024 bytes in netty?
Q4	3	Managing DTLS using a non-blocking architecture
Q5	3	Netty 4.0.19.Final Memory Leak with io.netty.channel.ChannelOutboundBuffer$Entry
Q6	3	What are the Netty alternatives for high-performance networking?
Q7	3	Is there any point in using Netty with Disruptor performance-wise?
Q8	2	Sending File from Server to Client by using Netty.io
Q9	2	What&#39;s the best way to reduce latency on downstream in netty?
Q10	2	MITM with Netty 5.0: Browser unable to receive full http response