Number	Votes	Question
Q1	4	Retrofit connection failure returns RetrofitError.response as null
Q2	3	What causes &quot;java.io.IOException: stream was reset: CANCEL&quot; with okhttp and spdy?
Q3	2	OkHttp 2.0 manually verifying cipher suite in use
Q4	2	why can I only read 2048 bytes at a time from an okhttp.Response InputStream?
Q5	2	How to suppress Charset being automatically added to Content-Type in okhttp
Q6	2	how to use okhttp to upload a file?
Q7	2	Retrofit &quot;java.net.ProtocolException: Unexpected status line&quot;  Anyone?