Number	Votes	Question
Q1	7	Understanding try catch finally with return
Q2	5	Calling a method and passing an object reference and catching the return with same reference
Q3	4	LIBGDX: What is the meaning of the return value of an InputAdapter&#39;s keyDown  keyUp...etc
Q4	2	Idiom for converting false boolean return value into exception?
Q5	2	How to get value from Object
Q6	2	Differences between System.out.printlin() and Return in Java
Q7	2	Why java method does not support multiple return values?
Q8	2	Java&#39;s int read(byte[] data) returns more bytes than expected
Q9	2	While loop guaranteed to return a value  what should replace return statement?
Q10	2	return multiple values in jsp