Number	Votes	Question
Q1	7	Anything missing from my android project test setup?
Q2	5	How to test mock interaction on Activity onResume() Using Dagger Modules and Robolectric?
Q3	5	osx maven running tests Exception: java.lang.OutOfMemoryError thrown from the UncaughtExceptionHandler in thread &quot;main&quot;
Q4	4	Multiple issues with Robolectric and ActionBarActivity test
Q5	2	Has anyone implemented robolectric 2.3 with couchbase-lite-android 1.02?
Q6	2	Exception when using an enum member in parameterized test class with JUnit
Q7	2	Cannot run Robolectric tests with Gradle and Android Studio - StyleData not found