Number	Votes	Question
Q1	8	Android BigInteger ArithmeticException
Q2	7	RSA: encrypt in iOS  decrypt in Java
Q3	5	Getting too short array with RSA encryption when data array&#39;s first entry is zero
Q4	4	How to generate a very big BigInt
Q5	3	Can you set the RSA public exponent to a value of your choice?
Q6	3	Encryption/Decryption in Android with RSA
Q7	3	RSA algorithm implementation not working properly in java
Q8	3	Share and store RSA - public key in java server and vice versa
Q9	3	How can I decrypt an &quot;encrypted string with java&quot; in c sharp?
Q10	2	Android&#39;s KeyStore getKey returning null