Number	Votes	Question
Q1	5	Android parse Plist file
Q2	4	SAX parser get attribute from endelement
Q3	3	How to disable accessExternalDTD and entityExpansionLimit warnings with logback
Q4	2	What is the difference between XML Pull Parser and SAX Parser
Q5	2	Java SAX is not parsing properly
Q6	2	Namespace handling with SAX in Java
Q7	2	Cannot remove namespace of SOAP response using SAXFilter
Q8	2	How to get element&#39;s value from xml using Sax parser in startElement?
Q9	2	Way to capture part XML code in SAXParser
Q10	2	Invoking the parser with new File in the parse(new File(args[0])  handler);