Number	Votes	Question
Q1	23	How to control SimpleDateFormat parse to 19xx or 20xx?
Q2	11	How to improve performance of SimpleDateFormat wrapped in ThreadLocal?
Q3	7	Fetching the first date of a week in java
Q4	6	Strange behaviour of ww SimpleDateFormat
Q5	5	Java DateFormat.parse thinks &quot;100 112TH AVE NE&quot; is a date
Q6	4	Java SimpleDateFormat gives different time zone for different day
Q7	4	How to make SimpleDateFormat.parse() fail hard?
Q8	4	java.text.ParseException: Unparseable date: &quot;01:19 PM&quot;
Q9	3	Weird Date parsing error in Java
Q10	3	Unparseable Date In America/Mazatlan timezone