Number	Votes	Question
Q1	13	Audio streaming via TCP socket on Android
Q2	6	HttpURLConnection: BindException when creating many connections
Q3	6	RDP through Bluetooth
Q4	6	java.net.SocketException: sendto failed: EPIPE (Broken pipe) on Android
Q5	5	Mixing two audio streams into a single audio stream in android?
Q6	5	Java to Lua socket communication error
Q7	4	How to parse a proxy socks packet in java?
Q8	4	How to interrupt Callable threads that are blocked inside a loop?
Q9	4	Faster detection of interrupted connections during PUT operation with Apache &#39;HttpClient&#39;
Q10	4	Why is exception not thrown when the connection is terminated?