Number	Votes	Question
Q1	164	What actually causes a Stack Overflow error?
Q2	20	Why is the max recursion depth I can reach non-deterministic?
Q3	13	Odd Java StackOverflowError?
Q4	6	Why doesn&#39;t Stack Overflow always occur?
Q5	5	This in Java - Exception in thread &quot;main&quot; java.lang.StackOverflowError
Q6	4	StackOverflow exception while adding one array list to another
Q7	4	Stack overflow occurring on first procedure call inside recursive procedure
Q8	4	StackOverflow when checking if one string is contained in another
Q9	4	stackoverflow when serializing hashmap in snakeyaml
Q10	3	Recursion Stack Overflow/Infinite-loop issue