Number	Votes	Question
Q1	3	How does ensureCapacity work in Java?
Q2	3	Difference for single line append and multiple line append in StringBuffer?
Q3	3	Java regex on a long string(String buffer)
Q4	3	Coding for the first time (Java hangman game)- going from console-based to GUI
Q5	2	Should I rewrite string concat using stringBuilder if I have enough memory?
Q6	2	String vs StringBuffer. Tip of IDEA
Q7	2	Does Android have an intern Char Limit for a String?
Q8	2	Adding column to CSV file with StringBuffer values (Java)
Q9	2	StringBuffer and appender method